title,summary,url,source,publication_date,sentiment
Microsoft’s Billionaire Founder Bill Gates Says THIS Is What Makes India So Special - EXCLUSIVE,"In an exclusive interview with Times Now, Microsoft founder Bill Gates expressed admiration for India's talent, innovation, ...",https://www.msn.com/en-in/news/India/microsoft-s-billionaire-founder-bill-gates-says-this-is-what-makes-india-so-special-exclusive/ar-AA1BmbqN?ocid=BingNewsVerp,MSN,2025-03-21,Neutral
Microsoft replaces its chief people officer to rethink performance reviews: Report,"Kathleen Hogan will be replaced by Amy Coleman, a Microsoft HR executive who had worked in the company for 25 years.",https://www.msn.com/en-in/news/India/microsoft-replaces-its-chief-people-officer-to-rethink-performance-reviews-report/ar-AA1BhvRZ?ocid=BingNewsVerp,MSN,2025-03-20,Neutral
Microsoft accidentally uninstalled Copilot in its latest Windows 11 update,"Microsoft’s latest Windows 11 update, released as part of March’s Patch Tuesday on 11 March, has led to the unintended ...",https://www.msn.com/en-in/money/topstories/microsoft-accidentally-uninstalled-copilot-in-its-latest-windows-11-update/ar-AA1B8gZu?ocid=BingNewsVerp,MSN,2025-03-18,Positive
Microsoft Windows And Office Users Issued Major Security Warning By Indian Govt: Here Are The Details,"Microsoft Office, Windows and other business customers are at the risk of hacking owing to multiple vulnerabilities that may ...",https://www.news18.com/tech/microsoft-windows-and-office-users-issued-major-security-warning-by-indian-govt-here-are-the-details-9266278.html,4d,2025-03-19,Negative
Microsoft and Gates Foundation to support Maharashtra in AI-driven digital governance and women’s entrepreneurship initiative,Maharashtra government partners with Microsoft and Gates Foundation to drive AI integration for digital governance and ...,https://www.thehindubusinessline.com/news/national/microsoft-and-gates-foundation-to-support-maharashtra-in-ai-driven-digital-governance-and-womens-entrepreneurship-initiative/article69354029.ece,2d,2025-03-21,Neutral
Microsoft@50 recap: Company faithful mark first 50 years and look to future at GeekWire event,"GeekWire hosted hundreds of longtime Microsoft employees, key executives, company faithful and tech community members ...",https://www.msn.com/en-us/money/other/microsoft-50-recap-company-faithful-mark-first-50-years-and-look-to-future-at-geekwire-event/ar-AA1Bp9rD?ocid=BingNewsVerp,MSN,2025-03-22,Neutral
"Microsoft, Gates Foundation collaborates with Maha govt on digital governance model",Microsoft’s co-founder and renowned philanthropist Bill Gates along with representatives from the Gates Foundation met ...,https://www.msn.com/en-in/news/India/microsoft-gates-foundation-collaborates-with-maha-govt-on-digital-governance-model/ar-AA1BiWsn?ocid=BingNewsVerp,MSN,2025-03-20,Neutral
Microsoft is developing its own AI models to compete with OpenAI: Report,"Microsoft has been moving away from its exclusive reliance on OpenAI, and a new report highlights this shift even further.",https://www.msn.com/en-in/money/topstories/microsoft-is-developing-its-own-ai-models-to-compete-with-openai-report/ar-AA1AB0BR?ocid=BingNewsVerp,MSN,2025-03-10,Positive
