title,summary,url,source,publication_date,sentiment
Sony offering PlayStation users Apple Music for free; here’s how to claim it,Sony is offering PlayStation 5 users up to three months of free Apple Music subscription by signing up through their console.,https://www.msn.com/en-in/money/news/sony-offering-playstation-users-apple-music-for-free-here-s-how-to-claim-it/ar-AA1BfxTx?ocid=BingNewsVerp,MSN,2025-03-20,Positive
"Sony unveils next-gen display technology, outshining Mini LED TVs",Sony has announced the development of a groundbreaking display technology that promises even richer and more vivid colors ...,https://www.digitimes.com/news/a20250321PD201/sony-display-rgb-led-oled-panel-2025.html,DIGITIMES5h,2025-03-24,Positive
Sony's Horror Franchise Reboot From Barbarian Director Has Seemingly Found Its Lead Star,The Resident Evil film series has a storied history that spans two decades of moviemaking and now the new reboot has ...,https://gamerant.com/sonys-horror-franchise-reboot-found-lead-star/,Game Rant10h,2025-03-24,Negative
"Best 55 inch smart TVs in March 2025: Top 10 models from Samsung, Sony, LG and more binge-watching movies and shows","A 55-inch smart TV is the perfect size for most living rooms, offering an immersive viewing experience without overwhelming ...",https://www.msn.com/en-in/lifestyle/shopping/best-55-inch-smart-tvs-in-march-2025-top-10-models-from-samsung-sony-lg-and-more-binge-watching-movies-and-shows/ar-AA1Bj2jq?ocid=BingNewsVerp,MSN,2025-03-21,Positive
Iluminate Your IPL Experience With These Top Sony TVs,"Upgrade your IPL experience with Sony's latest TVs, offering unmatched clarity, rich colors, and deep sound. Get ultra-smooth ...",https://www.herzindagi.com/your-picks/gadget-zone/iluminate-your-ipl-experience-with-these-top-sony-tvs-2516,HerZindagi3d,2025-03-21,Positive
Sony allegedly working on a big 200 MP sensor for main cameras,It will arrive in flagship devices launching later this year. Samsung's ISOCELL HP9 200 MP sensor has been a success in ...,https://www.gsmarena.com/sony_allegedly_working_on_a_big_200_mp_sensor_for_main_cameras-news-67012.php,4d,2025-03-20,Positive
Sony headphones to reinvent the way you listen to music: 6 models we recommend,"Sony headphones have revolutionized the way we listen to music, but it is easy to feel overwhelmed with the myriad of options ...",https://www.livemint.com/technology/gadgets/sony-headphones-to-reinvent-the-way-you-listen-to-music-6-models-we-recommend-11741570227205.html,12d,2025-03-12,Positive
"Sony launches first-ever 800mm Super Telephoto Zoom G lens in India: Price, specs and more","Sony launches its first 800 mm super-telephoto zoom G lens in India, the FE 400-800mm F6.3-8 G OSS. Ideal for bird, wildlife, ...",https://www.msn.com/en-in/lifestyle/shopping/sony-launches-first-ever-800mm-super-telephoto-zoom-g-lens-in-india-price-specs-and-more/ar-AA1B6oqO?ocid=BingNewsVerp,MSN,2025-03-18,Positive
Sony’s official store is now in Gulshan,An official store of the world-renowned Japanese brand Sony is now open on the first floor of Habib Super Market in Gulshan-1 ...,https://www.dhakatribune.com/business/376739/sony%E2%80%99s-official-store-is-now-in-gulshan,Dhaka Tribune4d,2025-03-24,Positive
Sony Responds to PS5 and PS4 Complaints with Compensation for the PlayStation Network Outage,"For millions of PS5 and PS4 players, last weekend’s PlayStation Network (PSN) outage couldn’t have come at a worse time. The ...",https://glassalmanac.com/sony-responds-to-ps5-and-ps4-complaints-with-compensation-for-the-playstation-network-outage/,Google Glass Almanac2d,2025-03-22,Negative
